id,text,question_code_type,tags,class
59543616,rest controller request mapping count public count controller autowired count repo count repo autowired status repo status repo get mapping scan response entity count get count principal principal string uniq id string user name principal get name system println uniq id uniq id system println count repo count repo prints null system println repo count repo find by id uniq id get getting null here count count count repo find by id uniq id get count handshake response entity count http status forbidden count set username user name count set handshake true count repo save count optional status status opt status repo find by username and item id user name count get item get id status status status opt present status status status set amount count get amount status set handshake true status set item count get item status set points count get points status set merchant count get merchant status set username user name status status opt get status set points status get points count get points status repo save status response entity count http status ok pre authorize role role merchant get mapping update response entity count update count principal principal string item id amount string merchant name principal get name decimal format df2 decimal format system println merchant name principal count repo item item item repo find by id item id get merchant merchant merchant repo find by id merchant name get pt amount merchant get average price string pts df2 format pt points double parse double pts system println points points count count count count set points points count set amount amount count set item item count set merchant merchant string uniq id uuid random uuid string substring count set uniq id uniq id count set handshake false count repo save count custom response custom response custom response custom response set status success custom response set message updated points response entity count http status ok,class,"['java', 'spring', 'spring-boot', 'spring-mvc', 'spring-data-jpa']",oauth2
59107555,configuration enable web security public web security config web security configurer adapter autowired data source data source autowired configure global authentication manager builder auth exception auth jdbc authentication data source data source bean password encoder password encoder bcrypt password encoder override configure http security http exception http authorize requests request authenticated form login http basic oauth2login,class,"['java', 'spring', 'oauth-2.0']",oauth2
49727551,configuration enable web security enable oauth2client public secure config web security configurer adapter autowired oauth2client context oauth2client context value open id userinfo string user info uri value open id client id string client id value open id client secret string client secret value open id access token uri string access token uri value open id user authorization uri string user authorization uri override configure http security http exception http csrf disable add filter after sso filter basic authentication filter oauth2client authentication processing filter sso filter oauth2client authentication processing filter open idfilter oauth2client authentication processing filter resource open idfilter set rest template rest template user info token services token services user info token services user info uri client id token services set rest template rest template open idfilter set token services token services open idfilter bean scope value session proxy mode scoped proxy mode target class oauth2rest template rest template oauth2rest template protected resource details oauth2client context bean filter registration bean oauth2client filter registration oauth2client context filter filter filter registration bean registration filter registration bean registration set filter filter registration set order registration bean oauth2protected resource details protected resource details authorization code resource details details authorization code resource details details set client id client id details set client secret client secret details set access token uri access token uri details set user authorization uri user authorization uri details set scope arrays list read details set use current uri true details,class,"['java', 'spring', 'oauth-2.0', 'spring-security-oauth2']",oauth2
33618307,configuration enable web security enable global method security pre post enabled true public security config web security configurer adapter autowired user service user service autowired password encoder password encoder override configure http security http exception http exception handling authentication entry point http403forbidden entry point http authorize requests ant matchers restricted urls access role admin ant matchers urls permit all ant matchers access role registered autowired configure authentication manager authentication manager builder auth exception auth user details service user service password encoder password encoder bean override authentication manager authentication manager bean exception authentication manager bean,class,"['java', 'spring', 'spring-security-oauth2']",oauth2
53807428,configuration enable authorization server public authorization server config authorization server configurer adapter string realm example realm autowired token store token store autowired user approval handler handler autowired qualifier authentication manager bean authentication manager auth manager override configure client details service configurer clients exception clients memory client rest client client id authorized grant types password authorization code refresh token implicit authorities role client role trusted client scopes read write trust secret noop ssw0rd access token validity seconds invalid minutes refresh token validity seconds refresh minutes override configure authorization server endpoints configurer endpoints exception endpoints token store token store user approval handler handler authentication manager auth manager override configure authorization server security configurer oauth server exception oauth server realm realm client,class,"['java', 'spring', 'rest', 'spring-security', 'spring-security-oauth2']",oauth2
48003725,create order response create order string location id create order request body api exception object local var post body body verify required parameter location id set location id null api exception missing required parameter location id calling create order verify required parameter body set body null api exception missing required parameter body calling create order create path map variables string local var path v2 locations location id orders replace all location id api client escape string location id string query params list pair local var query params array list pair map string string local var header params hash map string string map string object local var form params hash map string object string local var accepts application json string local var accept api client select header accept local var accepts string local var content types application json string local var content type api client select header content type local var content types string local var auth names string oauth2 generic type create order response local var return type generic type create order response complete response create order response complete response complete response create order response api client invoke api local var path post local var query params local var post body local var header params local var form params local var accept local var content type local var auth names local var return type complete response get data,function,"['java', 'square']",oauth2
49141182,string obtain access token string username string password exception multi value map string string params linked multi value map params add grant type password params add client id client id params add username username params add password password result actions result mock mvc perform post oauth token params params http basic client id client secret accept content type expect status ok expect content content type content type string result string result return get response get content as string jackson json parser json parser jackson json parser json parser parse map result string get access token string,function,"['java', 'spring', 'spring-boot', 'junit', 'postman']",oauth2
44027140,java io buffered reader import java io input stream import java io input stream reader import java net http urlconnection import java net url import java nio charset standard charsets public eloqua oath2app main string args string site name marketing cloud08 string username account username string password password string uri https login eloqua com auth oauth2 token string client id app client id string client secret app client secret string auth string client id client secret format client id client secret string header authorization basic javax xml bind datatype converter print base64binary auth string get bytes string user and site site name username string response null url url url uri http urlconnection conn http urlconnection url open connection conn set request method post conn set request property content type application json conn set request property authorization header authorization conn set request property grant type password conn set request property scope full conn set request property username user and site the users sitename username form sitename username conn set request property password password post data uri get bytes standard charsets utf post data length post data length system println post data length post data length post data length in content empty conn set request property content length integer string post data length in content empty conn set request property content length conn set do output true input stream conn get input stream buffered reader rd buffered reader input stream reader string line line rd read line null response line system println response rd close conn disconnect exception print stack trace,class,"['java', 'authentication', 'oauth-2.0', 'http-post', 'eloqua']",oauth2
18668881,oauth2authenticator private logger logger logger get logger oauth2authenticator get name private session session public oauth2provider provider serial version uid 1l oauth2provider google oauth2 provider provides xoauth2 sasl mechanism put sasl client factory xoauth2 org scribe examples oauth2sasl client factory public initialize security add provider oauth2provider public imapstore connect to imap string host port string user email string oauth token debug exception properties props properties props put mail imaps sasl enable true props put mail imaps sasl mechanisms xoauth2 props put oauth2sasl client factory oauth token prop oauth token session session session get instance props session set debug debug urlname unused url name null imapsslstore store imapsslstore session unused url name string empty password store connect host port user email empty password store public test imap string user string oauth token initialize imapstore imap store connect to imap imap gmail com user oauth token true exception system println failed print stack trace main string args string username username gmail com string oauth token google example get oauth code explained test imap username oauth token,class,"['java', 'javamail', 'imap', 'google-oauth', 'gmail-imap']",oauth2
53333994,configuration enable web security property source classpath application properties public security configuration web security configurer adapter override configure http security http exception http csrf disable authorize requests ant matchers tlog authenticated oauth2login bean oauth2authorized client service authorized client service in memory oauth2authorized client service client registration repository bean oauth2authorized client repository authorized client repository oauth2authorized client service authorized client service authenticated principal oauth2authorized client repository authorized client service bean client registration repository client registration repository in memory client registration repository google client registration client registration google client registration common oauth2provider google get builder google client id xxx client secret zzz build,class,"['java', 'spring-mvc', 'spring-security', 'spring-security-oauth2', 'google-login']",oauth2
36302804,java io ioexception import java io input stream import java io input stream reader import java util arrays import java util list import com google api client auth oauth2 credential import com google api client googleapis auth oauth2 google client secrets import com google api client googleapis auth oauth2 google credential import com google api client googleapis javanet google net http transport import com google api client http http transport import com google api client json json factory import com google api client json jackson2 jackson factory import com google api client util store file data store factory import com google api services gmail gmail import com google api services gmail gmail scopes import com google api services gmail model label import com google api services gmail model list labels response public comunico test sergio http transport http transport json factory json factory jackson factory get default instance java io file data store dir java io file system get property user home credentials comunico test sergio json file data store factory data store factory string application name comunico http transport google net http transport new trusted transport data store factory file data store factory data store dir throwable print stack trace system exit credential authorize ioexception input stream comunico test sergio get resource as stream comunico test sergio client secret json input stream reader isr input stream reader google client secrets client secrets google client secrets load json factory isr credential credential google credential builder set transport http transport set json factory json factory set service account id comunico test sergio comunico test sergio comunico iam gserviceaccount com set service account scopes arrays list gmail scopes gmail labels set service account user otticanet ad gmail com set client secrets client secrets build credential gmail get gmail service exception credential credential authorize gmail builder http transport json factory credential set application name application name build main string args gmail service get gmail service string user list labels response list response service users labels list user execute list label labels list response get labels labels size system println no labels found system println labels label label labels system printf label get name exception ex ex print stack trace,class,"['java', 'google-oauth', 'gmail-api', 'google-api-java-client']",oauth2
60744800,configuration public security configuration web security configurer adapter override configure http security http exception http csrf disable authorize requests ant matchers intranet bokning authenticated ant matchers intranet permit all request authenticated logout logout success url permit all oauth2login,class,"['java', 'spring-boot', 'spring-security', 'oauth-2.0', 'token']",oauth2
27456023,main activity list activity list activity activity string screen name google string log tag rnc list view listview text view text override create bundle saved instance state create saved instance state set content view layout twit list listview get list view activity download tweets listview set on item click listener on item click listener override item click adapter view parent view view position id selected item string lst txt parent get item at position position string trim launching activity selecting single list item intent intent main activity single list item sending data activity put extra product lst txt start activity download twitter timeline first checking see network connection download tweets connectivity manager conn mgr connectivity manager get system service context connectivity service network info network info conn mgr get active network info network info null network info connected download twitter task execute screen name log log tag no network connection available uses async task download twitter user timeline download twitter task async task string void string string consumer key keyvaluexxxxx string consumer secret secretkeyxxxxxxx string twitter token url https api twitter com oauth2 token string twitter stream url https api twitter com statuses user timeline json screen name progress dialog progress dialog override use ui thread pre execute progress dialog progress dialog show boys look whose back ok let see progress dialog progress dialog main activity alert dialog theme holo dark progress dialog set indeterminate true progress dialog set indeterminate drawable get resources get drawable drawable loader progress dialog set message please wait unwrapping something you progress dialog show progress dialog set cancelable false progress dialog set canceled on touch outside false exception progress dialog dismiss toast make text get application context string toast length long show override string in background string screen names string result null screen names length result get twitter stream screen names result post execute convert json results twitter object array list tweets override post execute string result twitter twits json to twitter result lets write results console well tweet tweet twits log log tag tweet get text send tweets adapter rendering array adapter tweet adapter array adapter tweet activity android layout simple list item twits set list adapter adapter progress dialog dismiss converts string json data twitter object twitter json to twitter string result twitter twits null result null result length gson gson gson twits gson json result twitter illegal state exception ex eat exception twits convert json authentication object authenticated object authenticated json to authenticated string raw authorization authenticated auth null raw authorization null raw authorization length gson gson gson auth gson json raw authorization authenticated illegal state exception ex eat exception auth string get response body http request base request string builder sb string builder default http client http client default http client basic http params http response response http client execute request status code response get status line get status code string reason response get status line get reason phrase status code http entity entity response get entity input stream input stream entity get content buffered reader reader buffered reader input stream reader input stream utf string line null line reader read line null sb append line sb append reason unsupported encoding exception ex client protocol exception ex1 ioexception ex2 sb string string get twitter stream string screen name string results null step encode consumer key secret url encode consumer key secret string url api key urlencoder encode consumer key utf string url api secret urlencoder encode consumer secret utf concatenate encoded consumer key colon character encoded consumer secret string combined url api key url api secret base64 encode string string base64encoded base64 encode to string combined get bytes base64 no wrap step obtain bearer token http post http post http post twitter token url http post set header authorization basic base64encoded http post set header content type application www form urlencoded charset utf http post set entity string entity grant type client credentials string raw authorization get response body http post authenticated auth json to authenticated raw authorization applications verify value associated token type key returned object bearer auth null auth token type equals bearer step authenticate api requests bearer token http get http get http get twitter stream url screen name construct normal https request include authorization header value bearer http get set header authorization bearer auth access token http get set header content type application json update results body response results get response body http get unsupported encoding exception ex illegal state exception ex1 results,class,"['java', 'android', 'listview', 'twitter']",oauth2
32127685,outer inner,class,['java'],unrelated
37780074,list read file string file list array list file file file list string lines null lines files read lines charsets utf ioexception list list array list string line lines list add line list,function,['java'],unrelated
53581989,learning import java util scanner public salary read in scanner scan scanner system public salary read in public get salary current salary system println enter current salary current salary scan next int current salary public calculate current salary get salary new salary current salary system println your salary new salary public main string args salary read in salary salary read in salary get salary salary calculate,class,['java'],unrelated
53449095,nearly equal epsilon abs math abs abs math abs diff math abs shortcut handles infinities true diff float min normal zero extremely close relative error less meaningful diff epsilon float min normal use relative error diff math min abs abs float max value epsilon,function,['java'],unrelated
29315333,test main string args system println counting generator string next list integer list array list integer list add integer list add integer integer exception integer list array,class,['java'],unrelated
23692732,multiples of threeand five main string args system println multiple system println multiple,class,['java'],unrelated
29167091,player turn token token p1 p2 p1,function,['java'],unrelated
33529239,java awt border layout import java awt container import java awt flow layout import java awt grid bag layout import java awt grid layout import javax swing jbutton import javax swing jframe import javax swing jtext area public canvas jframe canvas canvas draw set default close operation jframe exit on close set size container pane get content pane pane set layout grid layout jbutton button jbutton integer string pane add button figure pane figure pane pane add,class,['java'],unrelated
5678082,if lie horizontal line left otherwise,class,['java'],unrelated
35839282,dice game public main string args system println roll the dice first roll math random second roll math random first roll second roll system println roll first roll system println roll second roll total first roll second roll system println the total total system println you rolled doubles system println roll first roll system println roll second roll total first roll second roll system println the total total,class,['java'],unrelated
18940466,there letter string name chars name char array chars character letter false true,function,['java'],unrelated
47626782,main string args scanner reader scanner system system println enter first number integer number1 reader next int system println enter second number integer number2 reader next int number1 number2 system println true system println false,function,['java'],unrelated
14896340,main332 main string args child child child system println child value returns child value prints parent parent child system println parent value returns parent value prints parent parent2 parent system println parent2 value returns parent2 value prints public child parent num lookup num public parent val parent val lookup value val lookup silly,class,['java'],unrelated
9170213,java util scanner public driver private age car value tickets public get info scanner scanner system system println enter age age next int system println enter car value car value next int system println enter number tickets tickets next int,class,['java'],unrelated
42559238,java lang math import java util scanner public hello world main string args system println gimmie value scanner scan scanner system v1 scan next int system println v1,class,['java'],unrelated
