id,text,question_code_type,tags,class
38104983,bean oauth2protected resource details sparklr authorization code resource details details authorization code resource details details set id sparklr tonr details set client id tonr details set token name oauth token details set client secret secret details set access token uri access token uri details set user authorization uri user authorization uri details set scope arrays list openid details set grant type client credentials details set authentication scheme authentication scheme none details set client authentication scheme authentication scheme none details,function,"['java', 'spring', 'spring-mvc', 'spring-security', 'spring-oauth2']",oauth2
55612123,configuration enable resource server public resource server configuration resource server configurer adapter resource server configuration system println resource server configuration constructor string resource id rest api override configure resource server security configurer resources exception system println resource server configuration configure requested resources resources resource id resource id stateless false override configure http security http exception system println resource server configuration configure requested http request http anonymous disable request matchers ant matchers login authorize requests ant matchers login access role admin exception handling access denied handler oauth2access denied handler,class,"['java', 'authentication', 'exception', 'oauth-2.0', 'spring-restcontroller']",oauth2
59347128,com codenation import com codenation entity log import org apache http header import org apache http http entity import org apache http name value pair import org apache http client entity url encoded form entity import org apache http client methods closeable http response import org apache http client methods http post import org apache http impl client closeable http client import org apache http impl client http clients import org apache http message basic name value pair import org apache http util entity utils import org junit jupiter api test import org junit runner run with import org springframework boot test context spring boot test import org springframework test context junit4 spring runner import java io ioexception import java util array list import java util list run with spring runner spring boot test web environment spring boot test web environment defined port public log tests test salvar log ioexception list log log list array list log list add logs for tests closeable http client http client http clients create default http post post req http post http localhost api v1 log post req add header content type application www form urlencoded post req add header authorization basic c3f1ywqy on nl y3jld header http post headers post req get all headers list name value pair params array list name value pair params add basic name value pair username admin admin com params add basic name value pair password secret params add basic name value pair grant type password post req set entity url encoded form entity params system println headers header header http post headers system println header string system println entities system println entity utils string post req get entity utf system println system println system println closeable http response response http client execute post req http entity http response response get entity string response string entity utils string http response utf system println response system println response string,class,"['java', 'junit', 'oauth-2.0']",oauth2
46060783,java util uuid import javax servlet http http servlet request import javax servlet http http session import javax servlet http http servlet response import org springframework stereotype controller import org springframework ui model import org springframework web bind annotation request mapping import org springframework web bind annotation request method import org springframework web bind annotation request param import org springframework web util uri components builder controller public index controller oauth2 urls string authority https login microsoftonline com string authorize url authority common oauth2 v2 authorize string token url authority common oauth2 v2 token string redirect url http localhost outlook profiles authtoken string token url http localhost outlook profiles show token credentials string app id 7414b3a3 26f1 9d0b 7060d01dd41c string app password qg9f0eaxua er np2yeg yaz8 string scopes openid offline access profile user read contacts read mail read request mapping value index method request method get string index model model http servlet request request http servlet response response uuid state uuid random uuid uuid nonce uuid random uuid save state nonce session verify auth process redirects back http session session request get session session set attribute expected state state session set attribute expected nonce nonce index request mapping value oauthorize method request method post oauthorize model model http servlet request servlet request http servlet response servlet response uuid state uuid random uuid uuid nonce uuid random uuid http session session servlet request get session session set attribute expected state state session set attribute expected nonce nonce session set attribute error null uri components builder url builder uri components builder http url authorize url url builder query param client id app id url builder query param redirect uri redirect url url builder query param response type code id token url builder query param scope get scopes url builder query param state state url builder query param nonce nonce url builder query param response mode form post string location uri url builder uri string system println location uri servlet response send redirect location uri exception print stack trace request mapping value authtoken method request method post string authorize request param code string code request param id token string id token request param state uuid state http servlet request servlet request http servlet response servlet response get expected state value session http session session servlet request get session uuid expected state uuid session get attribute expected state uuid expected nonce uuid session get attribute expected nonce string str state state string trim lower case string str ex state expected state string trim lower case make sure state query parameter returned matches expected state str state equals str ex state session set attribute auth code code session set attribute id token id token system println expectedstate no error session set attribute error unexpected state returned authority system println unexpected state returned authority authtoken request mapping value get token method request method post get token http servlet request servlet request http servlet response servlet response http session session servlet request get session string str code string session get attribute auth code uri components builder url builder uri components builder http url token url url builder query param client id app id url builder query param client secret app password url builder query param code str code url builder query param redirect uri redirect url url builder query param grant type authorization code url builder query param scope get scopes string location uri url builder uri string system println get token location uri servlet response set header content type application www form urlencoded servlet response send redirect location uri exception print stack trace request mapping value show token method request method post string show token request param token type string code request param expires string id token request param access token string access token request param scope string param scope http servlet request servlet request http servlet response servlet response get token request mapping logout string logout http servlet request request http session session request get session session invalidate index string get scopes string builder sb string builder string scope scopes sb append scope string strscope sb string trim system println strscope strscope,class,"['java', 'spring', 'outlook-api']",oauth2
13262164,post path authorize produces application www form urlencoded public response get oauth grant header param oauth2 authorization default value string authorization header param oauth2 client id default value string client id header param oauth2 client secret default value string client secret header param oauth2 grant type default value string grant type internal server exception unauthorized exception oauth2 validate grant request client id client secret authorization grant type api token v2 api token v2 api token v2 api token v2 token manager get api token client id api token v2 null api token v2 generate access grant client id logger error error token endpoint retrieved token null internal server exception server error occurred trying authorize requester could find generate access grant method naming exception internal server exception server error occurred trying authorize grant request could find generate access grant method response status response status see other type media type application form urlencoded type header location api token header authorization oauth header access grant api token v2 get access grant build,function,"['java', 'web-services', 'redirect', 'http-headers', 'jax-rs']",oauth2
49033409,component public login attempts logger event listener audit event happened audit application event audit application event audit event audit event audit application event get audit event system println principal audit event get principal audit event get type web authentication details details web authentication details audit event get data get details system println remote ip address details get remote address system println session id details get session id,class,"['java', 'spring', 'spring-boot', 'spring-security', 'spring-boot-actuator']",oauth2
49079406,configuration enable web security public security configurer web security configurer adapter autowired authentication provider authentication provider override configure authentication manager builder auth auth authentication provider authentication provider override configure http security http exception http authorize requests request authenticated http basic,class,"['java', 'spring', 'spring-boot']",oauth2
50415537,org slf4j logger org slf4j logger factory org springframework beans factory annotation autowired org springframework context annotation configuration org springframework core annotation order org springframework security authentication authentication manager org springframework security config annotation web builders http security org springframework security core userdetails user details service org springframework security oauth2 config annotation configurers client details service configurer org springframework security oauth2 config annotation web configuration authorization server configurer adapter org springframework security oauth2 config annotation web configuration enable authorization server org springframework security oauth2 config annotation web configuration enable resource server org springframework security oauth2 config annotation web configuration resource server configurer adapter org springframework security oauth2 config annotation web configurers authorization server endpoints configurer org springframework security oauth2 config annotation web configurers resource server security configurer org springframework security oauth2 provider token store in memory token store configuration public resource server config string server resource id oauth2 server logger log logger factory get logger resource server config in memory token store token store in memory token store autowired user details service user details service autowired authentication manager authentication manager configuration enable resource server order resource server resource server configurer adapter override configure resource server security configurer resources exception log info resource server security configurer resources token store token store resource id server resource id override configure http security http exception log info http security http anonymous disable request matchers ant matchers v1 authorize requests ant matchers v1 authenticated configuration enable authorization server order auth config authorization server configurer adapter override configure authorization server endpoints configurer endpoints exception log info authorization server endpoints configurer endpoints user details service user details service authentication manager authentication manager token store token store approval store disabled override configure client details service configurer clients exception log info client details service configurer clients clients memory client client authorized grant types password authorization code refresh token implicit client credentials authorities role client scopes read resource ids server resource id secret secret,class,"['java', 'rest', 'spring-boot', 'spring-security', 'oauth-2.0']",oauth2
45232002,spring boot application rest controller enable resource server enable oauth2client public sample resource application resource server configurer adapter override configure http security http exception http ant matcher authorize requests ant matchers login role user request authenticated bean request context listener request context listener request context listener main string args spring application run sample resource application args request mapping home string home home,class,"['java', 'spring-boot', 'oauth-2.0']",oauth2
41097203,request mapping v3 test me timestamp public test controller string hardcoded test value api operation nickname get test me value return test me value http method get authorizations authorization value oauth2 scopes authorization scope scope default scope description scope description request mapping method request method get produces media type application json value response body string get test me path variable timestamp string timestamp timestamp null hardcoded test value resource not found exception wrong timestamp format,class,"['java', 'rest', 'api', 'validation', 'timestamp']",oauth2
48523071,configuration public web security global config web security configurer adapter autowired user details service user details service autowired password encoder password encoder override configure authentication manager builder auth exception auth user details service user details service password encoder password encoder override configure web security web exception web ignoring ant matchers http method options override configure http security http exception http authorize requests api security handled elsewhere see oauth2server configuration ant matchers api oauth management permit all end api security request role user role admin name form login login page login permit all logout permit all,class,"['java', 'spring-boot', 'spring-security', 'spring-oauth2']",oauth2
17740727,java io buffered reader import java io buffered writer import java io ioexception import java io input stream reader import java io output stream writer import java io unsupported encoding exception import java net http urlconnection import java net malformed urlexception import java net url import java net urlencoder import java util array list import javax net ssl https urlconnection import org apache commons codec binary base64 import org json simple jsonarray import org json simple jsonobject import org json simple jsonvalue public test something string get token url https api twitter com oauth2 token string bearer token string consumer key key string consumer secret secret param args main string args encode keys apikey apisecret thread runnable override run bearer token request bearer token get token url system println search https api twitter com search tweets json 23phuse katja count system println bearer bearer token array list tweet tweets fetch search tweet https api twitter com search tweets json 23phuse katja count bearer token system println tweets size ioexception system println ioexception print stack trace start encodes consumer key secret create basic authorization key string encode keys string consumer key string consumer secret string encoded consumer key urlencoder encode consumer key utf string encoded consumer secret urlencoder encode consumer secret utf string full key encoded consumer key encoded consumer secret encoded bytes base64 encode base64 full key get bytes string encoded bytes unsupported encoding exception string constructs request requesting bearer token returns token string string request bearer token string end point url ioexception https urlconnection connection null string encoded credentials encode keys consumer key consumer secret system println encoded credentials encoded credentials url url url end point url connection https urlconnection url open connection system println connection connection set do output true connection set do input true connection set request method post connection set request property host api twitter com connection set request property user agent android phuse application connection set request property authorization basic encoded credentials connection set request property content type application www form urlencoded charset utf connection set request property content length connection set use caches false write request connection grant type client credentials parse json response json mapped object fetch fields jsonobject obj jsonobject jsonvalue parse read response connection obj null string token type string obj get token type string token string obj get access token token type equals bearer token null token string malformed urlexception ioexception invalid endpoint url specified connection null connection disconnect fetches first tweet given user timeline array list tweet fetch search tweet string end point url string bearer token ioexception https urlconnection connection null array list tweet tweets array list tweet url url url end point url connection https urlconnection url open connection connection set do output true connection set do input true connection set request method get connection set request property host api twitter com connection set request property user agent application connection set request property authorization bearer bearer token connection set use caches false string response read response connection system println response response system println connection get response message system println connection get response code system println parse json response json mapped object fetch fields jsonobject obj search jsonobject jsonvalue parse response jsonarray ja jsonarray obj search get statuses ja null ja size tweet tweet tweet jsonobject jsonobject ja get get user get screen name string jsonobject ja get get text string jsonobject jsonobject ja get get user get profile image url string tweets add tweet tweets malformed urlexception ioexception invalid endpoint url specified connection null connection disconnect writes request connection write request http urlconnection connection string text body buffered writer wr buffered writer output stream writer connection get output stream wr write text body wr flush wr close true ioexception false reads response given connection returns string string read response http urlconnection connection string builder str string builder buffered reader br buffered reader input stream reader connection get input stream string line line br read line null str append line system get property line separator str string ioexception string tweet string username string message string image url bitmap image bitmap tweet string username string message string url username username message message image url url image bitmap get bitmap url,class,"['java', 'android', 'twitter']",oauth2
56375933,transaction pact test target target target http target finance api token finance api token before class get authorisation token http headers header http headers header set content type application www form urlencoded header set authorization basic zmlu lwfwa tphc gktc2vjcm v0 header set connection keep alive header set cache control cache http entity string request http entity username sap password password2 grant type password header rest template rest template rest template response entity finance api token response rest template post for entity http oauth token request finance api token response get status code http status ok httpexception response get status code value finance api token response get body state consumer authorised authorise modify header here,class,"['java', 'pact', 'pact-jvm']",oauth2
55043117,java io buffered reader import java io ioexception import java io input stream reader import java net http urlconnection import java net malformed urlexception import java net url import com fasterxml jackson core json factory import com fasterxml jackson core json parser import com fasterxml jackson core json token public testing azure public string get access token string tenant id string client id string client secret malformed urlexception ioexception string endpoint string format https login microsoftonline com oauth2 token tenant id string post body string format grant type client credentials client id client secret resource client id client secret https management azure com http urlconnection conn http urlconnection url endpoint open connection conn set request method post conn add request property content type application www form urlencoded conn set do output true conn get output stream write post body get bytes conn connect if want see response content please use commented code buffered reader reader buffered reader input stream reader conn get input stream string builder builder string builder string line null line reader read line null builder append line reader close system println builder string the output access token token type bearer expires ext expires expires resource https management azure com access token ey j0e xai oi jkv1qi json factory factory json factory json parser parser factory create parser conn get input stream string access token null parser next token json token end object string name parser get current name access token equals name parser next token access token parser get text access token public string get rate card string subscription id string api version string offer id string currency string locale string region string access token malformed urlexception ioexception string endpoint string format https management azure com subscriptions providers microsoft commerce rate card api version filter offer durable id eq currency eq locale eq region info eq subscription id api version offer id currency locale region replace all http urlconnection conn http urlconnection url endpoint open connection conn set request method get conn add request property authorization bearer access token conn add request property content type application json conn connect buffered reader reader buffered reader input stream reader conn get input stream string builder builder string builder string line null line reader read line null builder append line reader close builder string public main string args malformed urlexception ioexception string tenant id string client id string client secret client secret java net urlencoder encode client secret utf system println client secret string access token get access token tenant id client id client secret system println access token string subscription id string api version preview string offer id string currency eur string locale de de string region de string rate card resp get rate card subscription id api version offer id currency locale region access token system println rate card resp,class,"['java', 'eclipse', 'azure', 'api']",oauth2
47870502,string get user names from graph exception string bearer token bearer get access token string url https graph microsoft com v1 users string return data null url api url url url urlconnection con api url open connection con set request property authorization bearer token con set request property content type application json buffered reader buffered reader input stream reader con get input stream string input line string buffer response string buffer input line read line null response append input line close return data response string system println return data exception system println return data private string get access token exception string url https login microsoftonline com common oauth2 v2 token url obj url url https urlconnection con https urlconnection obj open connection header con set request method post con set request property user agent target api con set request property accept language en us en string url parameters client id application id from application registration portal scope https 3a 2f 2fgraph microsoft com 2f client secret application secret from application registration portal grant type client credentials send post request con set do output true data output stream wr data output stream con get output stream wr write bytes url parameters wr flush wr close response code con get response code system println sending post request url url system println post parameters url parameters system println response code response code buffered reader buffered reader input stream reader con get input stream string input line string buffer response string buffer input line read line null response append input line close print result string return data response string system println return data map json token data gson json return data map string access token string json token data get access token system println access token access token,function,"['java', 'microsoft-graph', 'adal']",oauth2
