id,text,question_code_type,tags,class
37241302,test main string args rest template rest template rest template map string string map hash map string string map put grant type password map put client id test map put client secret test map put username test map put password test string url http localhost spring oauth server oauth token grant type grant type client id client id client secret client secret username username password password oauth token result rest template get for object url oauth token map system println result get access token,class,"['java', 'spring', 'curl', 'oauth']",oauth2
51917819,server import java io file input stream import java io ioexception import com google auth oauth2 google credentials import com google firebase firebase app import com google firebase firebase options import com google firebase database data snapshot import com google firebase database database error import com google firebase database database reference import com google firebase database firebase database import com google firebase database value event listener public main main string args ioexception fetch service account key json file contents file input stream service account file input stream src server something json initialize app service account granting admin privileges firebase options options firebase options builder set credentials google credentials stream service account set database url https something firebaseio com build firebase app initialize app options as admin app access read write data regardless security rules database reference ref firebase database get instance get reference status ref add listener for single value event value event listener override data change data snapshot data snapshot status data snapshot get value integer system println status override cancelled database error error,class,"['java', 'eclipse', 'firebase', 'firebase-authentication']",oauth2
48750257,configuration enable resource server public resource server config resource server configurer adapter override configure http security http exception http authorize requests ant matchers permit all ant matchers api secure authenticated,class,"['java', 'spring-security', 'oauth']",oauth2
41893985,configuration enable web security profile production order security properties access override order public security config web security configurer adapter autowired private user authorization service user authorization service autowired private data source data source autowired private configuration params service configuration params service autowired private access denied handler oauth access denied handler autowired private access decision manager access decision manager override public configure web security web exception web ignoring ant matchers api internal v1 user signup api internal v1 user activate api internal v1 user change password api internal v1 user password reset api internal v1 user verify password api internal v1 accounts activate api internal v1 user resend api internal v1 user quick signup override public configure http security http exception http ant matcher api internal v1 user login csrf disable authorize requests ant matchers api internal v1 user login permit all http exception handling authentication entry point authentication entry point access denied handler oauth access denied handler ant matcher api v3 oauth2 auth csrf disable authorize requests access decision manager access decision manager request matchers ant path request matcher api v3 oauth2 auth authenticated http remember me remember me services remember me services token validity seconds integer parse int configuration params service get remember me token validity seconds bean scope proxy mode scoped proxy mode target class public custom entry point authentication entry point custom entry point bean public remember me services remember me services persistent token based remember me services remember me services persistent token based remember me services configuration params service get remember me key user authorization service token repository remember me services set always remember true remember me services set cookie name configuration params service get remember me cookie name remember me services set token validity seconds integer parse int configuration params service get remember me token validity seconds remember me services bean override public authentication manager authentication manager bean exception authentication manager bean list authentication provider providers array list providers add remember me authentication provider provider manager providers override protected configure authentication manager builder auth exception auth user details service user authorization service auth authentication provider remember me authentication provider bean public persistent token repository token repository jdbc token repository impl token repository jdbc token repository impl token repository set data source data source token repository bean public remember me authentication filter remember me filter exception remember me authentication filter remember me filter remember me authentication filter authentication manager bean remember me services remember me filter bean public authentication provider remember me authentication provider remember me authentication provider configuration params service get remember me key,class,"['java', 'spring-mvc', 'spring-boot']",oauth2
13101870,com googledrive googledriveapp for google drive play services version added comments removed dead code stephen wylie import java io ioexception import java util array list import android accounts account import android accounts account manager import android app activity import android app progress dialog import android content context import android content dialog interface import android content dialog interface on click listener import android content intent import android os async task import android os bundle import android util log import android view view import android widget button import com google android gms auth google auth exception import com google android gms auth google auth util import com google android gms auth user recoverable auth exception import com google android gms common account picker import com google api client auth oauth2 bearer token import com google api client auth oauth2 credential import com google api client extensions android2 android http import com google api client googleapis extensions android2 auth google account manager import com google api client http http request factory import com google api client http http transport import com google api client http json json http request import com google api client http json json http request initializer import com google api client json jackson jackson factory import com google api services drive drive import com google api services drive drive apps list import com google api services drive drive files import com google api services drive drive request import com google api services drive drive scopes import com google api services drive model file import com google api services drive model file list public main activity activity choose account string account name request token button btn drive context ctx activity create bundle saved instance state etc other application logic belonging create btn drive set on click listener view on click listener click view choose account choose account intent intent account picker new choose account intent null null string com google false null null null null start activity for result intent choose account fetch access token asynchronously get and use auth token in async task account account async task account string string task async task account string string progress dialog progress dlg async task account string string override pre execute progress dlg progress dialog ctx progress dialog style spinner progress dlg set max progress dlg set title validating progress dlg set message verifying login data entered this action time seconds progress dlg set cancelable false progress dlg set indeterminate false progress dlg set on cancel listener android content dialog interface on cancel listener cancel dialog interface progress dlg dismiss cancel true progress dlg show override string in background account params get access token params override post execute string null wait extra intent account name get drive files progress dlg dismiss task execute account fetches token particular google account chosen user do not run this directly it must run asynchronously inside async task param activity param account return string get access token account account google auth util get token ctx account name oauth2 drive scopes drive readonly important drive scopes must changed depending level access want user recoverable auth exception start approval screen intent run activity add intent flag activity new task flag start activity for result get intent request token print stack trace null google auth exception print stack trace null ioexception print stack trace null drive get drive service http transport ht android http new compatible transport makes transport compatible android jackson factory jf jackson factory you need json parser help api response credential credential credential bearer token authorization header access method set access token account name http request factory rf ht create request factory credential drive builder drive builder ht jf null set json http request initializer json http request initializer override initialize json http request request ioexception drive request drive request drive request request drive request set pretty print true drive request set oauth token account name build obtains list files signed user google drive account get drive files drive service get drive service log site track function get drive files files list request request service files list set mime type text plain ioexception print stack trace file list files log site track request string files request execute ioexception print stack trace log site track exception array list file file list array list file files get items log site track files found files get items size file file list string file id get id string title get title log site track file file id title request set page token files get next page token request get page token null request get page token length activity result request code result code intent data request code choose account result code result ok account name data get string extra account manager key account name google account manager gam google account manager get and use auth token in async task gam get account by name account name log site track choose account request code request token result code result ok account name data get string extra account manager key account name log site track request token,class,"['java', 'android', 'google-drive-api', 'google-play-services']",oauth2
54279755,br com altha api config import org springframework beans factory annotation autowired import org springframework boot autoconfigure security security properties import org springframework context annotation bean import org springframework context annotation configuration import org springframework context annotation import import org springframework core annotation order import org springframework security authentication authentication manager import org springframework security config annotation authentication builders authentication manager builder import org springframework security config annotation method configuration enable global method security import org springframework security config annotation web configuration enable web security import org springframework security config annotation web configuration web security configurer adapter import org springframework security crypto password password encoder import org springframework security oauth2 config annotation web configuration enable authorization server import org springframework security oauth2 config annotation web configuration enable resource server import br com altha api security custom user details service configuration enable web security enable global method security pre post enabled true enable authorization server enable resource server order security properties basic auth order import encoders public oauth security config web security configurer adapter autowired password encoder user password encoder autowired custom user details service user details service override bean authentication manager authentication manager bean exception authentication manager bean override configure authentication manager builder auth exception auth user details service user details service password encoder user password encoder,class,"['java', 'spring-boot', 'spring-security', 'oauth-2.0']",oauth2
51644755,configuration enable oauth2sso public ui security config web security configurer adapter override configure http security http exception http ant matcher authorize requests ant matchers login permit all request authenticated,class,"['java', 'spring-boot', 'oauth-2.0', 'spring-security-oauth2', 'spring-cloud-gateway']",oauth2
37113250,spring security config authorization server configurer adapter autowired qualifier authentication manager bean authentication manager authentication manager override configure client details service configurer clients exception clients client details client details service override configure authorization server security configurer oauth server exception oauth server allow form authentication for clients token key access permit all check token access authenticated override configure authorization server endpoints configurer endpoints exception endpoints user approval handler user approval handler token services token services client details service client details service authentication manager authentication manager access token converter token enhancer bean custom token enhancer access token enhancer custom token enhancer custom token enhancer custom token enhancer custom token enhancer bean oauth2authentication entry point oauth authentication entry point oauth2authentication entry point oauth2authentication entry point oauth2authentication entry point oauth2authentication entry point set realm name test oauth2authentication entry point bean oauth2authentication entry point client authentication entry point oauth2authentication entry point client authentication entry point oauth2authentication entry point client authentication entry point set realm name test client client authentication entry point set type name basic client authentication entry point bean oauth2access denied handler oauth access denied handler oauth2access denied handler bean client credentials token endpoint filter client credentials token endpoint filter client credentials token endpoint filter client credentials token endpoint filter client credentials token endpoint filter client credentials token endpoint filter set authentication manager authentication manager client credentials token endpoint filter bean unanimous based access decision manager list access decision voter object access decision voter array list access decision voter object scope voter scope voter scope voter role voter role voter role voter authenticated voter authenticated voter authenticated voter access decision voter add scope voter access decision voter add role voter access decision voter add authenticated voter unanimous based access decision manager unanimous based access decision voter access decision manager bean client details user details service client details user details service exception client details user details service client details user details service client details user details service client details service client details user details service bean jwt access token converter token converter jwt access token converter converter jwt access token converter custom token sign key generator sign key custom token sign key generator converter set signing key sign key get security key converter bean jwt access token converter token enhancer jwt access token converter token enhancer jwt access token converter custom token sign key generator sign key custom token sign key generator token enhancer set signing key sign key get security key token enhancer set access token converter token converter token enhancer bean token enhancer chain token enhancer chain token enhancer chain token enhancer chain token enhancer chain list token enhancer delegates array list token enhancer delegates add token enhancer delegates add access token enhancer token enhancer chain set token enhancers delegates token enhancer chain bean default oauth2request factory request factory exception default oauth2request factory default oauth2request factory default oauth2request factory client details service default oauth2request factory bean client credentials token granter token granter exception authorization server token services token services token services oauth2request factory request factory request factory client credentials token granter client credentials token granter client credentials token granter token services client details service request factory client credentials token granter bean jwt token store token store jwt token store token store jwt token store token enhancer token store bean default token services token services exception default token services default token services default token services default token services set token store token store default token services set support refresh token true default token services set access token validity seconds default token services set client details service client details service default token services set token enhancer token enhancer chain default token services bean default oauth2request factory auth2request factory exception default oauth2request factory default oauth2request factory default oauth2request factory client details service default oauth2request factory bean token store user approval handler user approval handler exception token store user approval handler token store user approval handler token store user approval handler token store user approval handler set request factory request factory token store user approval handler set token store token store token store user approval handler bean client details service client details service exception in memory client details service builder client restapp secret restapp authorized grant types password authorization code scopes read authorities role user access token validity seconds build,class,"['java', 'spring']",oauth2
56144376,override configure http security http exception http csrf disable authorize requests ant matchers login callback webjars error permit all request authenticated http basic session management session creation policy session creation policy stateless override configure authentication manager builder auth exception auth ldap authentication ldap authorities populator custom ldap authorities populator user dn patterns uid ou people group search base ou groups context source url env get property spring ldap urls env get property spring ldap base password compare password attribute user password password encoder ldap sha password encoder,function,"['java', 'spring', 'spring-security', 'spring-security-oauth2', 'spring-security-ldap']",oauth2
42171397,com google api client googleapis auth oauth2 google authorization code flow import com google api client googleapis auth oauth2 google token response import com google api client http javanet net http transport import com google api client json jackson2 jackson factory import org apache http http response import org apache http client http client import org apache http client methods http post import org apache http entity string entity import org apache http impl client http client builder import java io buffered reader import java io ioexception import java io input stream reader import java util arrays import java util list public google plust shenanigans string client secret client secret string client id client id list string scope arrays list https www googleapis com auth plus https www googleapis com auth plus stream write string redirect uri https www someuri com oauth2callback main string args ioexception google authorization code flow flow google authorization code flow builder net http transport jackson factory client id client secret scope set access type offline set offline token refreshed build string url flow new authorization url set redirect uri redirect uri build system println please open following url browser type authorization code system println url buffered reader br buffered reader input stream reader system string code br read line google token response token response flow new token request code set redirect uri redirect uri execute string token token response get access token string refresh token token response get refresh token system println access token token system println refresh token refresh token post sample message token post string msg string token ioexception http client client http client builder create build http post post http post https www googleapis com plus domains v1 people activities string entity body string entity object original content msg access items type domain domain restricted true post set header content type application json post set header authorization oauth token post set entity body http response resp client execute post system println resp get status line get status code system println resp get status line get reason phrase system println resp string,class,"['java', 'google-plus', 'google-domain-api']",oauth2
40802877,main string args twitter exception configuration builder cf configuration builder cf set debug enabled true set oauth consumer key 3tt35ow myxxxxxxis lq vdf0y set oauth consumer secret mtb kxwv cgrc4k3xxxxxxxxxxxxxxxh j1mwet efzn rz set oauth access token sonr eaxxxxxxxxxd d4uzcm buu p4vs vmw z4zh hqf5 set oauth access token secret e1w r16ral a2ht0xxxxxxxxxxnh n5iv9izk1k1mag ox twitter factory tf twitter factory cf build twitter4j twitter twitter tf get instance list status status twitter get home timeline status st status system println st get user get name st get text,function,"['java', 'twitter', 'oauth-2.0']",oauth2
37196802,com fasterxml jackson annotation json ignore import org hibernate validator constraints not empty import javax persistence import java util hash set import java util set entity public user id generated value strategy generation type auto integer id not empty string name not empty column unique true nullable false string login not empty string password json ignore many to many fetch fetch type eager join table name user role join columns join column name user id inverse join columns join column name role id set role roles hash set role user user user user id user get id name user get name login user get login password user get password roles user get roles integer get id id set id integer id id id string get name name set name string name name name string get login login set login string login login login string get password password set password string password password password set role get roles roles set roles set role roles roles roles,class,"['java', 'spring', 'hibernate']",oauth2
46593946,my verticle abstract verticle override start exception http server server vertx create http server router router router router vertx oauth2auth auth provider git hub github auth create vertx client id client secret oauth2auth handler oauth2 oauth2auth handler create auth provider git hub http localhost callback oauth2 setup callback router route router route handler oauth2 handler routing context request handler routing context string param value routing context request get param param routing context response end param param value router get endpoint handler request handler router get endpoint handler request handler server request handler router accept listen,class,"['java', 'oauth-2.0', 'vert.x']",oauth2
48806067,enable web security configuration public security config bean user details service user details service exception in memory user details manager manager in memory user details manager manager create user user username user password user pass roles user build manager create user user username admin password admin pass roles admin build manager configuration order api web security configuration adapter web security configurer adapter override configure authentication manager builder auth exception auth memory authentication user user password user roles user auth memory authentication user admin password admin roles admin configure http security http exception http ant matcher api v1 authorize requests ant matchers api v1 authenticated http basic configuration order form login web security configurer adapter web security configurer adapter override configure authentication manager builder auth exception auth memory authentication user user1 password user roles user auth memory authentication user admin1 password admin roles admin override configure http security http exception http ant matcher api test authorize requests ant matchers api test authenticated form login,class,"['java', 'spring', 'spring-security', 'spring-java-config']",oauth2
