id,text,question_code_type,tags,class
47310687,jwtfilter generic filter bean string authorization header custom token string authorities key roles filter method creating correct token bearer taken front end part param req param res param filter chain ioexception servlet exception override filter servlet request req servlet response res filter chain filter chain ioexception servlet exception http servlet request request http servlet request req string auth header request get header authorization header auth header null auth header starts with bearer http servlet response res send error http servlet response sc unauthorized invalid authorization header string token auth header substring claims claims jwts parser set signing key secretkey parse claims jws token get body request set attribute claims claims security context holder get context set authentication get authentication claims filter chain filter req res signature exception http servlet response res send error http servlet response sc unauthorized invalid token method creating authentication spring security context holder jwt claims authentication get authentication claims claims list simple granted authority authorities array list list string roles list string claims get authorities key string role roles authorities add simple granted authority role user principal user claims get subject authorities username password authentication token username password authentication token username password authentication token principal authorities username password authentication token,class,"['java', 'spring-boot', 'twitter', 'jwt', 'spring-social-twitter']",oauth2
50373750,enable auto configuration configuration enable oauth2sso controller public client application web security configurer adapter logger logger logger factory get logger client application request mapping hello string home principal user http servlet request request http servlet response response model model servlet exception model add attribute name user get name hello override configure http security http exception formatter http ant matcher authorize requests ant matchers login webjars error permit all request authenticated logout logout success url permit all csrf csrf token repository cookie csrf token repository http only false formatter main string args spring application builder client application properties spring config name application run args,class,"['java', 'spring', 'spring-cloud', 'spring-security-oauth2']",oauth2
36381353,main string args string url https www googleapis com oauth2 v3 userinfo access token fake token http urlconnection conn http urlconnection url url open connection conn get response code conn get input stream exception ex ex print stack trace print ioexception java io ioexception server returned http response code url https www googleapis com oauth2 v3 userinfo access token abc if commented conn get response code the ioexception,function,"['java', 'exception', 'exception-handling', 'httpurlconnection', 'http-status-codes']",oauth2
36109695,com google gwt http client import com googlecode gwt crypto bouncycastle util encoders base64 import java util map import java util function consumer public http manager string form data map string string data string builder sb string builder map entry string string entry data entry set sb append append entry get key append append entry get value sb delete char at sb string post form data string url map string string data consumer response success consumer response fail request exception string data as string form data data request builder builder request builder request builder post url builder set header content type application www form urlencoded builder set header accept application www form urlencoded builder set header authorization basic base64 encode app id oauth secret get bytes builder send request data as string request callback override response received request request response response response get status code fail accept response success accept response override error request request throwable throwable fail accept null,class,"['java', 'http', 'gwt']",oauth2
41806328,com jason lattimer crm auth import java io buffered reader import java io ioexception import java io input stream reader import java net http urlconnection import java net malformed urlexception import java net url import java util concurrent executor service import java util concurrent executors import java util concurrent future import javax naming service unavailable exception import com microsoft aad adal4j authentication context import com microsoft aad adal4j authentication result import com microsoft aad adal4j client credential import net minidev json jsonobject import net minidev json jsonvalue public app crm url string resource xxxxxx crm8 dynamics com string client id xxxxxxx xxxxx xxxxxxx xxxxxxxxx string client secret key xxxxxxxxxxxxxxxxxxxxxx string tenantid xxxxxxxxxxx xxxx xxxxx xxxxxxx string authority login microsoftonline com tenantid oauth2 authorize main string args exception authentication result result get access token from user credentials system println access token result get access token system println token expires result get expires on string user id who am result get access token system println user id user id string fullname find fullname result get access token 2b8fc8ca 86cd e611 c4346bdc0e01 system println fullname fullname authentication result get access token from user credentials exception authentication context auth context null authentication result auth result null executor service service null service executors new fixed thread pool auth context authentication context authority false service client credential client cred client credential client id client secret key future authentication result future auth context acquire token resource client cred null auth result future get exception ex system println ex service shutdown auth result null service unavailable exception authentication result null auth result string find fullname string token string user id malformed urlexception ioexception system println aaaaaaaaaaaaaaaaaa http urlconnection connection null the url change include api version api data v8 systemusers url url url resource api data systemusers user id select fullname connection http urlconnection url open connection connection set request method get connection set request property odata max version connection set request property odata version connection set request property accept application json connection add request property authorization bearer token response code connection get response code buffered reader buffered reader input stream reader connection get input stream string input line string buffer response string buffer input line read line null response append input line close object response response jsonvalue parse response string jsonobject object jsonobject response string fullname object get fullname string system println full name fullname fullname string who am string token malformed urlexception ioexception http urlconnection connection null the url change include api version api data v8 who am url url url resource api data who am connection http urlconnection url open connection connection set request method get connection set request property odata max version connection set request property odata version connection set request property accept application json connection add request property authorization bearer token response code connection get response code buffered reader buffered reader input stream reader connection get input stream string input line string buffer response string buffer input line read line null response append input line close object response response jsonvalue parse response string jsonobject object jsonobject response string user id object get user id string user id,class,"['java', 'dynamics-crm']",oauth2
47845755,configuration public jackson configuration string spring hateoas object mapper hal object mapper autowired qualifier spring hateoas object mapper object mapper spring hateoas object mapper primary bean name object mapper object mapper object mapper java time module java time module java time module java time module add serializer zoned date time zoned date time serializer date time formatter iso instant spring hateoas object mapper register modules java time module spring hateoas object mapper disable deserialization feature fail on unknown properties spring hateoas object mapper disable deserialization feature read date timestamps as nanoseconds spring hateoas object mapper disable serialization feature write date timestamps as nanoseconds spring hateoas object mapper disable serialization feature write dates as timestamps spring hateoas object mapper disable serialization feature fail on empty beans spring hateoas object mapper enable serialization feature indent output spring hateoas object mapper set serialization inclusion json include include non null spring hateoas object mapper,class,"['java', 'spring', 'spring-boot', 'jackson', 'hateoas']",oauth2
17350337,droa app twitch import java io buffered reader import java io ioexception import java io input stream reader import java net urisyntax exception import java util array list import org apache http http response import org apache http name value pair import org apache http client client protocol exception import org apache http client entity url encoded form entity import org apache http client methods http post import org apache http impl client default http client import org apache http message basic name value pair public notifier param args urisyntax exception ioexception client protocol exception main string args urisyntax exception client protocol exception ioexception http post request http post https api twitch tv kraken oauth2 token org apache http client http client client default http client array list name value pair post parameters array list name value pair post parameters add basic name value pair grant type password post parameters add basic name value pair client id credentials clientid post parameters add basic name value pair client secret credentials clientsecret post parameters add basic name value pair username credentials username post parameters add basic name value pair password credentials password post parameters add basic name value pair scope user read request set entity url encoded form entity post parameters http response http response client execute request buffered reader rd buffered reader input stream reader http response get entity get content string line line rd read line null system println line,class,"['java', 'api', 'apache-httpclient-4.x']",oauth2
38279753,org springframework context annotation configuration import org springframework security oauth2 config annotation configurers client details service configurer import org springframework security oauth2 config annotation web configuration authorization server configurer adapter import org springframework security oauth2 config annotation web configurers authorization server security configurer configuration public authorization server config authorization server configurer adapter override configure client details service configurer clients exception clients memory client acme secret acmesecret authorized grant types authorization code refresh token password scopes openid auto approve true override configure authorization server security configurer oauth server exception oauth server token key access permit all check token access authenticated,class,"['java', 'spring', 'spring-security', 'oauth-2.0']",oauth2
50682076,enable resource server configuration public resource server config web security configurer adapter override configure http security http exception http authorize requests ant matchers customers v2 permit all ant matchers api authenticated bean authentication manager authentication manager authentication provider authentication provider custom authentication manager authentication provider bean authentication provider authentication provider user repository user repository password encoder password encoder dbauthentication provider user repository password encoder,class,"['java', 'spring', 'oauth-2.0', 'spring-security-oauth2']",oauth2
27707971,configuration enable authorization server public oauth2config authorization server configurer adapter autowired private authentication manager authentication manager autowired private mongo client details service cds override public configure authorization server endpoints configurer endpoints exception endpoints authentication manager authentication manager override public configure client details service configurer clients exception clients client details cds,class,"['java', 'spring', 'spring-security', 'oauth-2.0']",oauth2
44410417,configuration enable web security public oauth2security configuration web security configurer adapter override configure http security http exception http csrf disable anonymous disable authorize requests ant matchers http method options oauth token permit all session management session creation policy session creation policy stateless bean cors configuration source cors configuration source cors configuration configuration cors configuration configuration set allowed origins arrays list http localhost configuration set allowed methods arrays list get post url based cors configuration source source url based cors configuration source source register cors configuration configuration source,class,"['java', 'spring', 'spring-boot', 'spring-security', 'oauth-2.0']",oauth2
29959255,configuration order protected login config web security configurer adapter autowired authentication manager authentication manager override configure http security http exception formatter http form login login page login permit all request matchers ant matchers login oauth authorize oauth confirm access authorize requests request authenticated session management formatter override configure authentication manager builder auth exception auth parent authentication manager authentication manager,class,"['java', 'single-sign-on', 'spring-security-oauth2', 'spring-cloud']",oauth2
31918707,com google api client googleapis auth oauth2 google credential import com google api client http http transport import com google api client http javanet net http transport import com google api client json jackson jackson factory import com google gdata client spreadsheet spreadsheet service import com google gdata data spreadsheet spreadsheet entry import com google gdata data spreadsheet spreadsheet feed import com google gdata util service exception import java io file import java io ioexception import java net malformed urlexception import java net url import java security general security exception import java util arrays import java util list public main main string args malformed urlexception general security exception ioexception service exception url spreadsheet feed url spreadsheet feed url url https spreadsheets google com feeds spreadsheets full file p12 file key p12 http transport http transport net http transport jackson factory json factory jackson factory string scopesarray https spreadsheets google com feeds https spreadsheets google com feeds spreadsheets full https docs google com feeds list scopes arrays list scopesarray google credential credential google credential builder set transport http transport set json factory json factory set service account id cliend id set service account scopes scopes set service account private key from p12file p12 build spreadsheet service service spreadsheet service test service set oauth2credentials credential error occurs the method set oauth2credentials google credential undefined type spreadsheet service spreadsheet feed feed service get feed spreadsheet feed url spreadsheet feed list spreadsheet entry spreadsheets feed get entries spreadsheets size system println no spreadsheets found spreadsheet entry spreadsheet null spreadsheets size spreadsheets get get title get plain text starts with list of sandboxes spreadsheet spreadsheets get system println name editing spreadsheet spreadsheets get get title get plain text system println id spread sheet,class,"['java', 'google-api', 'google-sheets', 'google-spreadsheet-api']",oauth2
54222234,configuration enable authorization server public authorization server config authorization server configurer adapter autowired data source data source autowired token store token store autowired jwt access token converter jwt token enhancer autowired user approval handler user approval handler autowired authentication manager authentication manager override configure client details service configurer clients exception clients jdbc data source override configure authorization server security configurer security security check token access authenticated override configure authorization server endpoints configurer endpoints exception endpoints token store token store token enhancer jwt token enhancer user approval handler user approval handler authentication manager authentication manager path mapping oauth token login,class,"['java', 'rest', 'spring-security', 'spring-security-oauth2']",oauth2
45000737,configuration public oauth2configuration configuration enable resource server resource server configuration resource server configurer adapter autowired custom authentication entry point custom authentication entry point autowired custom logout success handler custom logout success handler override configure http security http exception http exception handling authentication entry point custom authentication entry point logout logout url oauth logout logout success handler custom logout success handler csrf disable headers frame options disable exception handling session management session creation policy session creation policy stateless authorize requests ant matchers http method options permit all ant matchers api v1 login permit all ant matchers api v1 admin permit all ant matchers api v1 test permit all ant matchers oauth token permit all ant matchers api authenticated configuration enable authorization server authorization server configuration authorization server configurer adapter environment aware string env oauth authentication oauth string prop clientid clientid string prop secret secret string prop token validity seconds token validity in seconds relaxed property resolver property resolver autowired data source data source bean token store token store jdbc token store data source autowired qualifier authentication manager bean authentication manager authentication manager override configure authorization server endpoints configurer endpoints exception endpoints token store token store authentication manager authentication manager override configure client details service configurer clients exception clients memory client property resolver get property prop clientid scopes read write authorities authorities role user name authorized grant types password refresh token authorization code implicit secret property resolver get property prop secret access token validity seconds property resolver get property prop token validity seconds integer refresh token validity seconds override set environment environment environment property resolver relaxed property resolver environment env oauth configuration enable web security public security configuration web security configurer adapter autowired user details service user details service bean custom password encoder password encoder custom password encoder autowired configure global authentication manager builder auth exception auth user details service user details service password encoder password encoder override configure web security web exception web ignoring ant matchers http method options ant matchers api login override configure http security http exception http http basic realm name web services session management session creation policy session creation policy stateless request matchers ant matchers oauth authorize authorize requests ant matchers oauth authorize authenticated override bean authentication manager authentication manager bean exception authentication manager bean enable global method security pre post enabled true jsr250enabled true global security configuration global method security configuration override method security expression handler create expression handler oauth2method security expression handler public user details service impl user details service inject account dao account dao override transactional user details load user by username string login account user from database null string lowercase login login lower case lowercase login contains user from database account dao get by email id lowercase login user from database account dao get by phone number lowercase login user from database null user from database get activated user not activated exception user lowercase login activated list granted authority granted authorities user from database get roles stream map authority simple granted authority authority get role name collect collectors list org springframework security core userdetails user user from database get account name user from database get account password granted authorities username not found exception user lowercase login found database,class,"['java', 'spring-boot', 'oauth-2.0']",oauth2
14188239,com google api client auth jsontoken json web signature import com google api client auth jsontoken json web token import com google api client auth jsontoken rsa sha256signer import com google api client auth oauth2 token request import com google api client auth oauth2 token response import com google api client http generic url import com google api client http http transport import com google api client http javanet net http transport import com google api client json json factory import com google api client json jackson2 jackson factory import com google api client util clock import java io file input stream import java io ioexception import java security general security exception import java security key store import java security key store exception import java security no such algorithm exception import java security private key import java security unrecoverable key exception import java security cert certificate exception public test client private key get private key string key file string alias string password key store exception ioexception no such algorithm exception certificate exception unrecoverable key exception key store keystore key store get instance pkcs12 keystore load file input stream key file password char array private key private key private key keystore get key alias password char array private key main string args general security exception ioexception string password notasecret string alias privatekey string key file key file p12 string service account scopes https www googleapis com auth urlshortener string service account user user1 gmail com string service account id id apps googleusercontent com json web signature header header json web signature header header set algorithm rs256 header set type jwt json web token payload payload json web token payload clock system current time clock system current time millis payload set issuer service account id set audience https accounts google com oauth2 token set issued at time seconds current time set expiration time seconds current time set principal service account user payload put scope service account scopes system println payload pretty string private key service account private key get private key key file alias password string assertion rsa sha256signer sign service account private key get json factory header payload token request request token request get transport get json factory generic url get token server encoded url assertion request put grant type urn ietf params oauth grant type jwt bearer request put assertion assertion token response resp request execute system println token resp get access token string get token server encoded url https accounts google com oauth2 token json factory get json factory jackson factory http transport get transport net http transport,class,"['java', 'oauth-2.0', 'google-oauth', 'google-url-shortener']",oauth2
44628536,configuration enable global method security pre post enabled true enable web security order security properties access override order public oauth2security configuration web security configurer adapter autowired client details service client details service autowired data source data source autowired global user details authentication manager builder auth exception auth jdbc authentication data source data source users by username query select username password users username authorities by username query select username name users roles role users ru username id ru users id ru roles id id auth memory authentication user admin password admin roles admin override configure http security http exception http csrf disable anonymous disable authorize requests ant matchers http method options oauth token permit all override configure web security web exception web ignoring ant matchers http method options oauth token override bean authentication manager authentication manager bean exception authentication manager bean,class,"['java', 'spring', 'spring-security', 'oauth-2.0', 'cors']",oauth2
