id,text,question_code_type,tags,class
37460690,main string args string user user string password password string host host name port string remote file home john test txt string yes yes jsch jsch jsch session session jsch get session user host port session set password password session set config strict host key checking system println establishing connection session connect channel channel session open channel exec after ask confirmation password channel exec channel set command ssh server name channel connect input stream output channel get input stream system println aafter stream read byte output read string builder output buffer string builder read byte 0xffffffff system println read read byte output buffer append read byte read byte output read system println output buffer string channel disconnect exception system err print error message,function,"['java', 'ssh']",ssh
26777784,com jcraft jsch import java io ioexception import java io input stream import java util logging level import java util logging logger public sshmanager private logger logger logger get logger sshmanager get name private jsch jsch sshchannel private string str user name private string str connection ip private int connection port private string str password private session ses connection private int time out private common constructor actions string user name string password string connection ip string known hosts file name jsch sshchannel jsch try jsch sshchannel set known hosts known hosts file name jsch exception jsch log error jsch get message str user name user name str password password str connection ip connection ip public sshmanager string user name string password string connection ip string known hosts file name common constructor actions user name password connection ip known hosts file name int connection port int time out public sshmanager string user name string password string connection ip string known hosts file name connection port common constructor actions user name password connection ip known hosts file name int connection port connection port int time out public sshmanager string user name string password string connection ip string known hosts file name connection port time out milliseconds common constructor actions user name password connection ip known hosts file name int connection port connection port int time out time out milliseconds public string connect string error message null try ses connection jsch sshchannel get session str user name str connection ip int connection port ses connection set password str password uncomment this for testing purposes but do not use in production ses connection set config strict host key checking java util properties config java util properties config put strict host key checking ses connection set config config ses connection connect int time out jsch exception jsch system println connection failed error message jsch get message error message private string log error string error message error message null logger log level severe object str connection ip int connection port error message error message private string log warning string warn message warn message null logger log level warning object str connection ip int connection port warn message warn message public string send command string command string builder output buffer string builder try channel channel ses connection open channel exec channel exec channel set command command channel connect input stream command output channel get input stream read byte command output read read byte 0xffffffff output buffer append read byte read byte command output read channel disconnect ioexception io log warning io get message null jsch exception jsch log warning jsch get message null output buffer string public close ses connection disconnect,class,"['java', 'python', 'ssh', 'remote-access', 'jsch']",ssh
26550571,remove directory string path session session interrupted exception channel exec channel exec null channel exec channel exec session open channel exec string command rm rf path channel exec set command command channel exec connect thread sleep channel exec disconnect jsch exception e1 false true,function,"['java', 'ssh', 'jsch']",ssh
45479647,main string args below declared defined sftp host port user local key make connection string sftphost ip sftpport string sftpuser user file id rsa id dsa based algorithm used create key string private key file string sftpworkingdir folder jsch sch jsch session session null channel channel null channel sftp channel sftp null sch add identity private key system println private key added session sch get session sftpuser sftphost sftpport system println session created java util properties config java util properties config put strict host key checking session set config config session connect channel session open channel sftp channel connect system println shell channel connected channel sftp channel sftp channel channel sftp cd sftpworkingdir system println changed directory jsch exception todo auto generated block print stack trace sftp exception todo auto generated block print stack trace channel sftp null channel sftp disconnect channel sftp exit channel null channel disconnect session null session disconnect,function,"['java', 'google-app-engine', 'ssh', 'datareader', 'calc']",ssh
10312802,register key pair jsch sch file hehe ssh mkdirs file private key file hehe ssh id rsa file public key file hehe ssh id rsa pub private key exists public key exists key pair key pair key pair gen key pair sch key pair rsa key pair key pair write private key private key get absolute path key pair write public key public key get absolute path hehekey true jsch exception system println gen key pair rsa print stack trace file not found exception system println gen key pair rsa print stack trace ioexception system println gen key pair rsa print stack trace false sch add identity private key get absolute path true jsch exception system println sch add identity print stack trace false public test jsch jsch jsch jsch set logger logger enabled true log string system println log jsch register key pair jsch string private key hehe ssh id rsa suppress warnings unused string public key hehe ssh id rsa pub session session jsch get session cisco jsch add identity private key cisco java util properties config java util properties config put strict host key checking session set config config session connect system println a4 channel shell channel channel shell session open channel shell system println a5 system println a6 channel connect jsch exception ex system println ex get message ex print stack trace exception,function,"['java', 'rsa', 'aes', 'cisco', 'jsch']",ssh
49243259,lport string rhost redacted string host redacted int rport string user redacted string password redacted string dbuser name redacted string dbpassword redacted string url jdbc mysql localhost lport db string driver name com mysql jdbc driver connection conn null session session null statement stmt null public init sqlexception set strict host key checking property avoid unknown host key issue java util properties config java util properties config put strict host key checking jsch jsch jsch session jsch get session user host session set password password session set config config session connect system println connected assinged port session set port forwarding lport rhost rport system println localhost assinged port rhost rport system println port forwarded mysql database connectivity class name driver name new instance conn driver manager get connection url dbuser name dbpassword system println database connection established system println done,code_block,"['java', 'mysql', 'jsch']",ssh
12595437,user auth ki main string arg jsch jsch jsch string host null arg length host arg host joption pane show input dialog enter username hostname system get property user name localhost string user host substring host index of host host substring host index of session session jsch get session user host username passphrase given via user info user info ui my user info session set user info ui session connect string new pass session get user info get password got null value thats null pointer exception occur system print new pass channel channel session open channel shell input stream byte array input stream new pass get bytes channel set input stream channel set output stream system channel connect exception system println my user info user info uikeyboard interactive string passwd jtext field password field jtext field jpassword field grid bag constraints gbc grid bag constraints grid bag constraints northwest grid bag constraints none insets container panel override string prompt keyboard interactive string destination string name string instruction string prompt echo todo auto generated method stub panel jpanel panel set layout grid bag layout gbc weightx gbc gridwidth grid bag constraints remainder gbc gridx panel add jlabel instruction gbc gbc gridy gbc gridwidth grid bag constraints relative jtext field texts jtext field prompt length prompt length gbc fill grid bag constraints none gbc gridx gbc weightx panel add jlabel prompt gbc gbc gridx gbc fill grid bag constraints horizontal gbc weighty echo texts jtext field texts jpassword field panel add texts gbc gbc gridy joption pane show confirm dialog null panel destination name joption pane ok cancel option joption pane question message joption pane ok option string response string prompt length prompt length response texts get text response null cancel override string get passphrase todo auto generated method stub null override string get password todo auto generated method stub passwd override prompt passphrase string arg0 todo auto generated method stub false override prompt password string message todo auto generated method stub object ob password field result joption pane show confirm dialog null ob message joption pane ok cancel option result joption pane ok option passwd password field get text true false override prompt yes no string str todo auto generated method stub object options yes foo joption pane show option dialog null str warning joption pane default option joption pane warning message null options options foo override show message string message joption pane show message dialog null message todo auto generated method stub,class,['java'],ssh
34433844,the command equal powershell run powershell correctly private execute command string command channel exec channel channel exec session open channel exec channel exec channel set command command output stream channel get output stream input stream channel get input stream channel connect write mkdir test get bytes flush tmp channel get exit status available read tmp system print string tmp channel closed system println exit status channel get exit status thread sleep exception ee system println ee channel disconnect ioexception todo auto generated block print stack trace jsch exception todo auto generated block print stack trace,function,"['java', 'spring', 'ssh', 'channel', 'execcommand']",ssh
11461679,sshclient ssh sshclient ssh connect ssh auth password abcde fgh char array session session ssh start session command cmd session exec cd home abcde desktop system println ioutils read fully cmd get input stream string cmd join time unit seconds system println exit status cmd get exit status session close ssh disconnect,code_block,"['java', 'ssh', 'sshj']",ssh
32024651,main string args exception string usr args string host args string password args jsch jsch jsch session session jsch get session usr host string pwd password session set password pwd hashtable string string config hashtable string string config put strict host key checking session set config config session connect session set server alive interval channel exec channel exec channel exec session open channel exec string cmd tail var log messages channel exec set command cmd input stream channel exec get input stream channel exec connect buffered reader buffered reader buffered reader input stream reader buffered reader ready string line buffered reader read line system println line thread sleep buffered reader close channel exec send signal sigint channel exec disconnect session disconnect system println exit,function,"['java', 'ssh', 'jsch']",ssh
47811402,execute shell commands connection connection list string command list exception session session connection open session input stream stdout stream gobbler session get stdout session request dumb pty session start shell string command command list the next line java io ioexception session exec command command buffered reader br buffered reader input stream reader stdout string line br read line string builder shell output string builder line null shell output append line line br read line session close,function,"['java', 'ssh']",ssh
49023238,jsch jsch jsch string private key path home abc ssh id rsa jsch add identity private key path properties config properties config put strict host key checking session session jsch get session user session set config config session connect channel channel session open channel shell output stream ops channel get output stream print stream ps print stream ops true channel connect ps println cdbb tail logs bbmq log grep saurabh input stream channel get input stream tmp true read tmp system print string tmp,code_block,['java'],ssh
9276487,java io ioexception import java util logging console handler import java util logging level import java util logging logger import javax jmdns jm dns import javax jmdns service event import javax jmdns service listener sample code service discovery using jm dns service listener run main method it listens http services lists changes system author werner randelshofer public discover services sample listener service listener override service added service event event system println service added event get name event get type override service removed service event event system println service removed event get name event get type override service resolved service event event system println service resolved event get info param args command line arguments main string args activate lines see log messages jm dns log false log logger logger logger get logger jm dns get name console handler handler console handler logger add handler handler logger set level level finer handler set level level finer jm dns jmdns jm dns create string type http tcp local args length type args jmdns add service listener type sample listener system println press enter quit system read stub jmdns close system println done ioexception print stack trace,class,"['java', 'jmdns']",ssh
9408831,com jscape inet ssh import com jscape inet ssh util ssh parameters import java io public sshexamplelalit ssh listener state ssh connection private connected false public sshexamplelalit ssh ssh null create ssh instance ssh parameters params ssh parameters sacsun mwctrl m33tz0n3 system print sacsun unix server connected ssh ssh params register capture events ssh add ssh listener system println sacsun connecting please wait ssh script script ssh script ssh ssh task task ssh task sacsun sh 07gretchen01965 07gretchen01965 connect script add task task ssh connect script complete system println waiting thread sleep exception print stack trace connected ssh disconnect exception captures ssh connected event public connected ssh connected event ev system println connected ev get host connected true system println connected server ev get host captures ssh data received event public data received ssh data received event ev ev get data captures ssh disconnected event public disconnected ssh disconnected event ev system println wait server disconnecting ev get host connected false main method ssh example public main string args sshexamplelalit test sshexamplelalit,class,"['java', 'jsp']",ssh
48567286,sshconnect string file ssh keys config jan main string args sshconnect invoke invoke jsch sch jsch sch add identity file session session sch get session my user name github company com session connect jsch exception print stack trace,class,"['java', 'ssh', 'jsch']",ssh
41376900,ssh exec password string host string username string password string command app obj app app port create jsch object this object execute shell commands scripts server jsch jsch jsch open session username host port set password call connect session connect opens new connection remote ssh server once connection established initiate channel channel needed connect remotely execution program java util properties config java util properties config put strict host key checking session session jsch get session username host port session set config config session set password password session connect create excution channel session channel exec channel exec channel exec session open channel exec gets input stream channel all data arriving messages remote side read stream input stream channel exec get input stream set command want execute in remote shell script string str command channel exec set command str channel exec connect read output input stream set buffered reader reader buffered reader input stream reader string line line reader read line null system println line retrieve exit status remote command corresponding channel exit status channel exec get exit status safely disconnect channel disconnect session if done may cause resource leak channel exec disconnect session disconnect exit status system println done exit status set exit status obj app write logs done exit status set exit status system println done error obj app write logs done error system println done obj app write logs ssh connection successful exception system err println error string writer sw string writer print writer pw print writer sw true print stack trace pw obj app write logs sw get buffer string,function,"['java', 'ssh', 'copssh']",ssh
45801314,com jcraft jsch import sshtest exec my user info import java io public sshconnection main string args jsch jsch jsch string user user id string host unixmachines company corp session session jsch get session user host user info ui my user info session set user info ui session connect string command pwd channel channel session open channel exec input stream channel get input stream channel exec channel set command command channel exec channel set err stream system err channel connect buffered reader reader buffered reader input stream reader string line index line reader read line null system println index line tmp true available read tmp system print string tmp channel closed available system println exit status channel get exit status thread sleep exception ee channel disconnect session disconnect exception system println,class,"['java', 'linux', 'unix', 'ssh']",ssh
43170483,execute command string username string pwd string hostname port jsch exception ioexception jsch sch jsch session session sch get session username hostname port session set password pwd properties properties properties properties put strict host key checking session set config properties session connect channel exec channel exec channel exec session open channel exec channel exec set command scp home rish haha txt output stream output stream channel exec get output stream data input stream input stream data input stream channel exec get input stream data output stream fos channel exec connect buf buf output stream write buf output stream flush true check ack input stream read input stream read buf filesize 0l true input stream read buf error buf filesize filesize 10l buf string file null input stream read buf buf 0x0a file string buf send buf output stream write buf output stream flush string file name data data get package name crearofile random next int txt string file name data data rish crearo trial haha txt file file1 file file name file1 exists file1 delete file1 create new file log tag file created log tag file created read content lfile fos data output stream file output stream file name string count count input stream read utf null system println count fos write bytes count fos close check ack input stream system exit input stream close send buf output stream write buf output stream flush session disconnect,function,"['java', 'android', 'jsch']",ssh
17989883,jsch jsch jsch session session null jsch add identity privatekey ppk password session jsch get session user session set config strict host key checking channel channel session open channel sftp channel connect channel sftp sftp channel channel sftp channel sftp channel put users test txt home user test txt sftp channel exit session disconnect,code_block,"['java', 'ssh', 'jsch']",ssh
23791014,ssh server credentials string host string user login string password password port the host want send http requests remote host string remote host test com remote port properties config properties config put strict host key checking jsch jsch jsch session session jsch get session user host port session set password password session set config config session connect channel channel session get stream forwarder remote host remote port the get request string cmd get foo foo http input stream channel get input stream output stream channel get output stream channel connect bytes cmd get bytes input stream byte array input stream cmd get bytes utf num read num read read bytes write bytes num read flush channel disconnect session disconnect system println request supposed sent buffered reader reader buffered reader input stream reader string line line reader read line null system println line java io ioexception exc system println exc string exception print stack trace,code_block,"['java', 'http', 'ssh', 'jsch', 'channel']",ssh
34743398,connect ssh sqlexception java util properties config java util properties jsch jsch jsch jsch set logger my logger session jsch get session ssh user ssh host jsch add identity ssh key filepath ssh password config put strict host key checking config put connection attempts session set config config session connect system println ssh connected class name driver name new instance assinged port session set port forwarding local port remote host remote port system println localhost assinged port ssh host remote port system println port forwarded exception print stack trace,function,"['java', 'mysql', 'database', 'jdbc', 'ssh']",ssh
36151893,jsch jsch jsch string host null host string private key test key string cmd string command jsch add identity private key session session jsch get session user1 host channel channel session open channel shell user info ui my user info prompt yes no string message true session set user info ui session connect output stream ops channel get output stream print stream ps print stream ops true channel connect ps println cmd ps println command ps close input stream channel get input stream bt available read bt read string str string bt system print str channel null channel disconnect session disconnect system println channel connected,code_block,"['java', 'ssh']",ssh
21083525,java io ioexception import org apache commons exec command line import org apache commons exec default executor import org apache commons exec execute watchdog public apache run sshkeygen param args command line arguments public main string args ioexception string line acro rd32 exe file get absolute path string line execute ssh ssh keygen exe command line cmd line command line parse line default executor executor default executor watchdog executor set exit value execute watchdog watchdog execute watchdog executor set watchdog watchdog exit value executor execute cmd line exception exc system println error exc handle exception,class,"['java', 'ssh', 'command']",ssh
54188208,import com jcraft jsch channel exec import com jcraft jsch jsch import com jcraft jsch session import java io input stream public test jsch jsch instance jsch main string args exception session session jsch instance get session username domain session set password password session set config strict host key checking session connect channel exec channel channel exec session open channel exec channel set input stream null input stream err channel get err stream input stream channel get input stream channel set command sudo service rscedit start channel connect channel get exit status thread sleep command stays stuck eof sent input stream result err available err string builder response builder string builder result available response builder append result read system println response builder channel disconnect session disconnect,class,"['java', 'jsch']",ssh
48974382,main string args ioexception sshclient ssh sshclient ssh load known hosts ssh connect host port ssh auth password user passwd ssh use compression string src system get property user home file separator test file ssh new scpfile transfer upload file system file src tmp ssh disconnect ssh close,function,"['java', 'authentication', 'ssh', 'sshj']",ssh
56758040,string user user string ssh pwd pwd string host host stored open ssh key file found error shoud move file string key pk int port basic ssh connection stuff jsch jsch jsch session jsch get session user host port jsch add identity key ssh pwd get bytes,code_block,"['java', 'android', 'ssh', 'jsch']",ssh
18401248,ssh wrapper ssh ssh wrapper ssh connect ssh login ssh set prompt c898vqz ssh waitfor system println pwd ssh send pwd ssh disconnect system println ssh get class java io ioexception print stack trace,code_block,"['java', 'unix', 'ssh']",ssh
4194439,jsch shell jsch string command cd home src session session shell get session username host port my user info ui my user info ui set password password session set user info ui session connect channel session open channel shell server buffered reader input stream reader channel get input stream server channel get output stream channel connect server write command get bytes server flush,code_block,"['java', 'ssh', 'jsch']",ssh
