id,text,question_code_type,tags,class
30727515,main string args the comment typo u000d system println hello world,function,"['java', 'unicode', 'comments']",unrelated
3633103,test shared members protected m17multiples protected m23multiples public method primitive m17multiples m23multiples calc17primitive calc23primitive m17multiples m23multiples private calc17primitive m17multiples private calc23primitive m23multiples using object wrappers class int wrapper int int wrapper int get int int increment int public method object int wrapper o17 int wrapper int wrapper o23 int wrapper calc17object o17 calc23object o23 o17 get int o23 get int private calc17object int wrapper increment private calc23object int wrapper increment public main string args test shared members test shared members num iters start system current time millis total num iters total method primitive stop system current time millis system println total system println stop start start system current time millis total num iters total method object stop system current time millis system println total system println stop start,class,['java'],unrelated
25889524,to change template choose tools templates open template editor package exercise pkg25 author public exercise 425app param args command line arguments main string args total sum of total total sum of total total system println sum of total,class,['java'],unrelated
30365488,javax swing import java awt import java awt event public main jframe action listener public tile board private container content pane private jbutton reset private icon image icon black png private icon image icon red png private turn1 private turn2 private jump available private count public main set cross platform java also called metal uimanager set look and feel uimanager get cross platform look and feel class name unsupported look and feel exception handle exception class not found exception handle exception instantiation exception handle exception illegal access exception handle exception content pane get content pane content pane set layout null set default close operation exit on close set title checkers set size set resizable false content pane set background color cyan darker board tile board tile board set bounds board add action listener board set opaque true board set background color black else board set background color red content pane add board board set icon board set icon board set icon board set icon turn1 true reset jbutton reset reset set bounds reset add action listener content pane add reset public main string args main frame main frame set visible true public action performed action event get source tile jump check tile clicked tile get source clicked tile get source system println clicked get row clicked get column count turn1 clicked board board get icon board get background color red clicked board board get row board get icon board get icon joption pane show message dialog null this piece cannot move please select another clicked board board get row board get icon joption pane show message dialog null this piece cannot move please select another clicked board board get row board get icon joption pane show message dialog null this piece cannot move please select another clicked board board get icon board get icon board get icon null clicked board board get icon board get icon board get icon null clicked board board get icon board get icon board get icon null board set icon null board set background color white clicked board board get icon board get icon board get icon null board set icon null board set background color white else board set icon null clicked board clicked get row board set background color white clicked board clicked get row board set background color white else board set background color white board set background color white clicked board board get icon null clicked board board get background color white clicked board board get icon null board get background color black joption pane show message dialog null please choose valid place jump clicked board board get icon board set icon turn1 false turn2 true board set background color red board set icon null clicked board board get icon board set icon turn1 false turn2 true board set background color red board set icon null clicked board board get background color red board get background color white count joption pane show message dialog null you really click piece want move count else board set icon turn1 false turn2 true board set background color red board set background color red board set background color red count else joption pane show message dialog null please choose valid place jump turn2 clicked board board get icon board get background color red clicked board board get row board get icon board get icon joption pane show message dialog null this piece cannot move please select another clicked board board get row board get icon joption pane show message dialog null this piece cannot move please select another clicked board board get row board get icon joption pane show message dialog null this piece cannot move please select another clicked board board get icon board get icon board get icon null clicked board board get icon board get icon board get icon null clicked board board get icon board get icon board get icon null board set icon null board set background color white clicked board board get icon board get icon board get icon null board set icon null board set background color white else board set icon null clicked board clicked get row board set background color white clicked board clicked get row board set background color white else board set background color white board set background color white clicked board board get icon null clicked board board get background color white clicked board board get icon null board get background color black joption pane show message dialog null please choose valid place jump clicked board board get icon board set icon turn2 false turn1 true board set background color red board set icon null clicked board board get icon board set icon turn2 false turn1 true board set background color red board set icon null clicked board board get background color red board get background color white count joption pane show message dialog null you really click piece want move count else board set icon turn2 false turn1 true board set background color red board set background color red board set background color red count else joption pane show message dialog null please choose valid place jump private jump check where would like force jumping,class,['java'],unrelated
22728063,arrays transpose good length length assign dimension want input length length nested loop go rows columns good elements good,class,['java'],unrelated
59239585,custom exception runtime exception custom exception string message message,class,['java'],unrelated
9320846,java util scanner scanner class public factorial calculator calculator fact num num fact fact main string args scanner calc scanner system create scanner calc num fact welcome user factorial calculator system println welcome factorial calculator system println string choice choice equals ignore case system println please enter integer greater less num calc next int system println the factorial num fact system println system println would like choice calc next system println,class,['java'],unrelated
12988294,base class class sub class base class sub class,class,['java'],unrelated
53156442,base class base integer value integer value value value hash code value hash code class base integer value integer value value value hash code value hash code,class,['java'],unrelated
8042599,condutor string name condutor name condutor string name name name set name string name name name string get name name override string string name,class,['java'],unrelated
10020955,tcomp main string args string arif string arif system println match,class,['java'],unrelated
13029758,java util public game private array list high score score array list high score private high score comparable high score guess count player time string player name high score guess count player time string player name guess count guess count player time player time player name player name string string string score list player name guess count player time score list compare to high score hs integer guess count compare to integer hs guess count else public main string args play game true scanner scan scanner system game game play game start system println play string scan next line equals ignore case system print quitting play game false public start number math random guess guess count string guess str player name string quit quit scanner scan scanner system play true system print welcome greatest guessing game time guess number type quit quit start time system current time millis system println debug nr number guess number play system print enter guess guess str scan next line guess str equals ignore case quit play false system println quitting guess integer parse int guess str guess guess system println invalid guess count guess number system println too low guess count guess number system println too high guess count number format exception system println sorry numbers try input mismatch exception ex system println sorry numbers try guess number end time system current time millis game time end time start time system println nice correct number number system print you nailed game time seconds guess count tries system println enter name player name scan next line score add high score guess count game time player name collections sort score system println name guesses time ms high score score system println,class,['java'],unrelated
14315182,areaprog import java util scanner public mainprog main string args area menu selection system println what shape need know area square rectangle triangle circle exit user input menu scanner reader scanner system system println number input reader next int reader next line depending user selection depends method called using scanner scan scanner system square selection input system println what length side square s1 scan next int sq ans areaprog areacode square s1 system println the area square sq ans rectangle selection input system println what width rectangle r1 scan next int system println what height rectangle r2 scan next int rec ans areaprog areacode rect r1 r2 system println the area rectangle rec ans triangle selection input system println what base length triangle t1 scan next int system println what height triangle t2 scan next int tri ans areaprog areacode triangle t1 t2 system println the area triangle tri ans circle selection input system println what radius circle c1 scan next int circ ans areaprog areacode circle c1 system println the area circle circ ans exit application input system println goodbye system exit,class,['java'],unrelated
55368724,string lyrics line number one line number two string words line number one line number two,code_block,['java'],unrelated
53901806,first class public num num set num new num num new num get num num second class public main string args system println get num set num system println get num print stuff third class public print stuff system println get num,class,['java'],unrelated
26381236,java util scanner public crypto string alphabet abcdefghijklmnopqrstuvwxyz decalage scanner scanner scanner system main string args system println veuillez entrer une chaine de caracteres string scanner next line la chaine coder string coder la chaine codee string chaine codee pos coder length alphabet system println la chaine coder est vide pos alphabet index of char at val pos decalage replace alphabet char at val chaine codee chaine codee replace system format la chaine initiale etait coder empty system println la chaine coder est vide system format la chaine coder est coder system format la chaine codee est chaine codee,class,['java'],unrelated
46739110,x509certificate build end entity cert public key entity key private key ca key x509certificate ca cert string client name exception string name cn client name x509v3certificate builder cert bldr jca x509v3certificate builder ca cert get subject x500principal big integer one date system current time millis date system current time millis validity period x500principal name entity key jca x509extension utils ext utils jca x509extension utils cert bldr add extension extension authority key identifier false ext utils create authority key identifier ca cert add extension extension subject key identifier false ext utils create subject key identifier entity key add extension extension basic constraints false basic constraints false add extension extension key usage false key usage key usage digital signature key usage key encipherment key usage non repudiation add extension extension extended key usage false extended key usage key purpose id id kp client auth content signer signer jca content signer builder sha256with rsa set provider bc build ca key jca x509certificate converter set provider bc get certificate cert bldr build signer,function,['java'],unrelated
46269895,hal9000 simulate ai interacts crew space ship public hal9000 string name returns name crew member string get name name sets crew name param crew member set name string new name string name new name hal greets crew member string greet crew member welcome name returns string consisting sorry name to do name crew member name string command string to do sorry name to do,class,['java'],unrelated
55855198,volleyball file string file name count string current file name string output file string first name string last name attack score defence score scanner input scanner system volleyball file file not found exception system println please enter file name get roster file name input next line file file file file name scanner scan scanner file scan next line result integer parse int scan next line count,class,['java'],unrelated
35836315,wit wit instance null wit wit get instance instance null instance wit instance,class,['java'],unrelated
35596804,copyright oracle affiliates all rights reserved oracle proprietary confidential use subject license terms package java util function represents operation single operand produces result type operand this specialization code function operand result type this href summary html functional whose functional method link apply object param type operand result operator see function since functional interface public unary operator function returns unary operator always returns input argument param type input output operator unary operator always returns input argument unary operator identity,class,['java'],unrelated
43008276,javax swing joption pane public lab10 string species color injuries name wiput liput location found oiput gender weight length shots needs shots tag number cage number outcome main string args stray animal species color weight length injuries location found name stray animal string species string color weight length string injuries string location found string name species joption pane show input dialog please enter species animal color joption pane show input dialog please enter color animal wiput joption pane show input dialog please enter weight animal weight float parse float wiput liput joption pane show input dialog please enter lenght animal length float parse float liput location found joption pane show input dialog please enter location animal found city county state injuries joption pane show input dialog please enter injuries animal seperated commas stray animal set outcome outcome oiput joption pane show input dialog please enter animal terminated animal saved outcome integer parse int oiput give shots give shots give shots true need shots need shots,class,['java'],unrelated
41635031,create new message message decider new message make room for new message get size get size need code set ttl msg ttl add to messages true find connections for new message get host true false,function,['java'],unrelated
20610769,push element size elements length resize doubel size elements size element public pop size java util empty stack exception element elements size elements size null set null last top element,function,['java'],unrelated
10147712,main string args system println shipping cost public shipping cost package type weight string e1 legal values package type must string e2 legal values weight cost package type package type exception e1,function,['java'],unrelated
43151246,java util scanner public tic tac toe game declare variables board game board turn true turn false turn scanner keyboard reads user input tic tac toe game turn true keyboard scanner system create board board initialize board board display row row system println board row board row board row rest game board display board display row system println display row system println display row system println which row column would like move enter two numbers separated space indicate position get move invalid true row column user input invalid row keyboard next int column keyboard next int check valid spot row row column column check position taken board row column system println that position already taken else invalid false fill game board player mark turn board row column else board row column winner row column check win winner last last winner false winner symbol board last last last made mark check left right num found board last symbol num found num found winner true check num found board last symbol num found num found winner true check diagonals num found board symbol num found num found winner true num found board symbol num found num found winner true winner board full many spots taken player num spots filled board board num spots filled num spots filled start game play true display board turn system println turn else system println turn choice keyboard next int choice get move winner display board display winner board turn system println wins else system println wins system exit board full tie display board display tie board system println tie system exit winner turn turn players main string args tic tac toe game game tic tac toe game game play,class,['java'],unrelated
22973879,java util array list public gaa club array list member players gaa club players array list member add standered member create message object std out println please enter members name std in read line string name std in read line std out println please enter members address string address std in read line std out println please enter members dob string dob std in read line std out println please enter amount pay mempaid std in read double member player member name address dob mempaid players add player add standared player create message object std out println please enter standard player name std in read line string name std in read line std out println please enter standard player address string address std in read line std out println please enter standard player dob string dob std in read line std out println please enter amount pay mempaid std in read double standard player player standard player name address dob mempaid players add player add elite player create message object std out println please enter elite players name std in read line string name std in read line std out println please enter elite players address string address std in read line std out println please enter elite players dob string dob std in read line std out println please enter amount pay mempaid std in read double std out println please enter elite players bmi bmi std in read double std out println please enter elite players height height std in read double elite player player elite player name address dob mempaid bmi height players add player main string args gaa club app gaa club app run member type std out println enter type membership std out println add standard member std out println add elite player std out println add standard player string memberchoice std in read string memberchoice equals add standered member memberchoice equals add elite player memberchoice equals add standared player list names member player players player list remove name member player players list names string response std in read string response equals player name players remove player main menu std out println add member std out println remove player std out println list names std out println list members std out println exit std out print option std in read int option run std out println posts option main menu option option member type remove name add standered member list names option main menu std out println exiting,class,['java'],unrelated
40778977,test main string args system print find gcf find gcf holder gcf greatest it can be greatest it can be greatest it can be greatest it can be holder gcf holder gcf holder gcf holder gcf,class,['java'],unrelated
51402832,java io class rak serializable public main main string args exception write code herer rak rak file file da txt file output stream f1 file output stream object output stream oos object output stream f1 oos write object value file input stream f0 file input stream object input stream f9 object input stream f0 rak r1 rak r1 rak f9 read object system println r1,class,['java'],unrelated
54233463,student student id string student name age list student associated students array list setters getters,class,['java'],unrelated
23224188,java util scanner public pex5 main string args num letters stack queue char count string unbounded stack interface character stack linked stack character unbounded queue interface character queue linked unbnd queue character system println enter word check palindrome suppress warnings resource scanner keyboard scanner system keyboard next line num letters length character ch char at num letters stack push ch queue enqueue ch char count char count num letters stack stack top stack pop queue queue dequeue stack queue system println not palindrome stack queue char count system println palindrome system println would like another yes keyboard next line system println,class,['java'],unrelated
26792447,java awt import java awt event import javax swing public morning jframe action listener easy sound rooster easy sound cow time morning morning rooster easy sound roost wav rooster play cow easy sound cow2 wav cow play time timer clock timer clock start container get content pane set background color white main string args morning morning morning morning set size morning set default close operation exit on close morning set visible true action performed action event container get content pane time rooster play set background color black time time cow play set background color white time,class,['java'],unrelated
20129221,java util scanner public prog3 main string args scanner input scanner system a1 input next line char at character upper case a1 string input next line size length arr char array size temp character upper case arr temp arr arr replace facing error system print arr,class,['java'],unrelated
33523294,java net import java io public tcpserver public main string args ioexception tcp component server socket server socket null socket client socket null port tcpprotocol nis tcpprotocol create object call method protocol class server socket server socket port system println waiting connection system println ioexception system println string could listen port port system exit client socket server socket accept system println tcp session established nis frame set visible true nis frame set always on top true system println ioexception system println string accept failed system exit print writer print writer client socket get output stream true buffered reader buffered reader input stream reader client socket get input stream string input line output line output line nis process answer null get learn learn english line println output line send line client nis jservertxt set text output line input line read line null output line nis process answer input line println output line nis jservertxt set text output line output line equals ignore case don miss bye bye output line equals ignore case thank for your guessing have nice day end connection flush close close nis frame set visible false client socket closed client socket close nis frame set visible false server socket closed server socket close nis frame set visible false system println tcp session closed,class,['java'],unrelated
20843033,first obj main string args object obj object object obj1 object system println obj system println obj1,class,['java'],unrelated
32048549,encode val val val val val 0x1f val 0f,function,['java'],unrelated
18968616,returns data specified position list protected word get pos head null index out of bounds exception node word temp head pos temp temp get next temp null index out of bounds exception temp get data displays word list protected display node word temp head get list size system println temp null index out of bounds exception temp get data temp temp get next,function,['java'],unrelated
53774145,demo main string args system println,class,['java'],unrelated
54962297,store map string list string items store items hash map string list string contains key string key items contains key key put string key string item list string list array list list null list array list string items put key item,class,['java'],unrelated
36189656,test public test first blank position assert equals sc1 first blank position assert equals sc2 first blank position,function,['java'],unrelated
